[
  {"assessment_id":"AS-L0203-COMPARE","lesson_id":"L-02-03","assessment_type":"scenario_choice","supports_objectives":["AI901-D1-O2","AI901-D1-O3"],"supports_python_skills":["PY-004"],"mastery_signal":"independent_use","attempt_policy":"Complete primary form closed-note, remediate every missed decision or reason, then score 16/16 on an unseen transfer form and explain one complete choice without notes.","result_states":["correct","partially_correct","incorrect","not_attempted","needs_review"],"records_confidence":true,"records_misconception_tags":true,"records_review_flag":true,"status":"review"}
]
