[
{"assessment_id":"AS-L0502-PROMPT","lesson_id":"L-05-02","assessment_type":"scenario_choice","supports_objectives":["AI901-D2-O1"],"supports_python_skills":["PY-004","PY-012"],"mastery_signal":"independent_use","attempt_policy":"Score primary 12/12, remediate every layer or safety miss, then score fresh transfer 12/12 and explain one complete prompt design without notes.","result_states":["correct","partially_correct","incorrect","not_attempted","needs_review"],"records_confidence":true,"records_misconception_tags":true,"records_review_flag":true,"status":"review"}
]
