{"assessment_id":"AS-CUM01-MIXED","lesson_id":"L-06-03","assessment_type":"readiness_gate","supports_objectives":["AI901-D1-O1","AI901-D1-O2","AI901-D1-O3","AI901-D1-O4","AI901-D1-O5","AI901-D1-O6","AI901-D1-O7","AI901-D1-O8","AI901-D2-O1","AI901-D2-O2","AI901-D2-O3","AI901-D2-O4","AI901-D2-O5","AI901-D2-O6","AI901-D2-O7"],"supports_python_skills":["PY-019","PY-020"],"mastery_signal":"independent_use","attempt_policy":"Pass primary 16/16, remediate each confusion pair through mapped lessons, then pass fresh transfer 16/16; confidence and timing cannot override misses.","result_states":["correct","partially_correct","incorrect","not_attempted","needs_review"],"records_confidence":true,"records_misconception_tags":true,"records_review_flag":true,"status":"review"}
